<?xml version="1.0" encoding="UTF-8"?>
<hu:battery xmlns:hu="http://hl7api.sourceforge.net/hunit/hunit_tests.xsd"
	xmlns:xsi="http://www.w3.org/2001/XMLSchema-instance"
        xsi:schemaLocation="http://hl7api.sourceforge.net/hunit/hunit_tests.xsd http://hl7api.sourceforge.net/hunit/hunit_tests.xsd">

	<hu:name>ORM_WCH_ccRIS to SIU_WCH_Kiosk</hu:name>
        
	<hu:interfaces>
		<hu:interface>
			<hu:jmsInterface id="from_ORM_WCH_ccRIS">
				<hu:connection_factory>com.stc.jms.client.STCTopicConnectionFactory</hu:connection_factory>
				<hu:connection_factory_constructor_arg type="java.lang.String" value="jcapsdev"/>
				<hu:connection_factory_constructor_arg type="int" value="18907"/>
				<hu:topic_name>tp_In_ORM_WCH_ccRIS</hu:topic_name>
				<hu:user_name>Administrator</hu:user_name>
				<hu:password>PASSWORD</hu:password>
				<hu:message_property type="java.lang.String" name="SOURCE_SYSTEM" value="WCH_ccRIS"/>
				<hu:message_property type="java.lang.String" name="SOURCE_INTERFACE" value="ORM"/>
			</hu:jmsInterface>
		</hu:interface>
		<hu:interface>
			<hu:jmsInterface id="to_SIU_WCH_Kiosk">
				<hu:connection_factory>com.stc.jms.client.STCQueueConnectionFactory</hu:connection_factory>
				<hu:connection_factory_constructor_arg type="java.lang.String" value="jcapsdev"/>
				<hu:connection_factory_constructor_arg type="int" value="18907"/>
				<hu:queue_name>q_Out_ADTSIU_WCH_Kiosk</hu:queue_name>
				<hu:user_name>Administrator</hu:user_name>
				<hu:password>PASSWORD</hu:password>
			</hu:jmsInterface>
		</hu:interface>			
	</hu:interfaces>
	<hu:tests>
		<hu:test>
			<hu:name>Regular Order</hu:name>
			<hu:send_message>
				<hu:hl7v2 interface_id="from_ORM_WCH_ccRIS" message_id="Normal Order In" />
			</hu:send_message>
			<hu:expect_message>
                <hu:hl7v2_specific interface_id="to_SIU_WCH_Kiosk" message_id="Normal Order Out"/>
			</hu:expect_message>
		</hu:test>
	</hu:tests>
	<hu:messages>
		<hu:hl7v2 id="Normal Order In">
			<hu:text><![CDATA[
MSH|^~\&|WCH_ccRIS|WCH|||200905131421||OMI^O23^OMI_O23|359|T|2.5
PID|||7009511^^^Sunnybrook^MR^^~01010101010^^^CANON^JHN^^||Test^Rbc^Clinic||19800717|F|||20 bay st^^TORONTO^ON^M5G 2N7^Can^H||(416)235-6897^PRN^PH
PV1|1|O||||||47251^Smith^Arnold I.^^^Dr^MD|47251^Smith^Arnold I.^^^Dr^MD||||||||||10940000227^^^Sunnybrook^VN||||||||||||||||||||||||||||||||
ORC|NW|123999^ccRIS|||SC|||||||140857^Ward^Richard^^^Dr.^MD^^2.16.840.1.113883.3.59.3:862^L^^^EI|||||||||||||||||
TQ1|1||||||200907171200|200907171230|
OBR||123999||0302005^CT Abdomen|||200907171200|200907171230||||||||140857^Ward^Richard^^^Dr.^MD^^2.16.840.1.113883.3.59.3:862^L^^^EI||||||||||||||||||||||||||||||
		]]></hu:text>
		</hu:hl7v2>
		<hu:hl7v2 id="Normal Order Out">
			<hu:text><![CDATA[
MSH|^~\&|WCH_ccRIS|WCH|||200905131421||SIU^S12^SIU_S12|359|T|2.5
SCH||123999^WCH_ccRIS||||S12^^HS
PID|||7009511^^^Sunnybrook^MR^^~01010101010^^^CANON^JHN^^||Test^Rbc^Clinic||19800717|F|||20 bay st^^TORONTO^ON^M5G 2N7^Can^H||(416)235-6897^PRN^PH
PV1|1|O||||||47251^Smith^Arnold I.^^^Dr^MD|47251^Smith^Arnold I.^^^Dr^MD||||||||||123999^^^WCH_ccRIS^VN|||||||||||||||||||||||||||||||
RGS|1||
AIS|1||MI_CT^CT Abdomen|200907171200|0|MIN^MINUTES^ISO|30|MIN^MINUTES^ISO||BOOKED^BOOKED^HL70278||		]]></hu:text>
		</hu:hl7v2>
	</hu:messages>
</hu:battery>